[
  {
    "id": "device_001",
    "device": "MacBook Pro",
    "browser": "Chrome 118.0",
    "ip": "192.168.1.100",
    "location": "San Francisco, CA",
    "current": true,
    "last_active": "2024-09-15T14:30:00Z"
  },
  {
    "id": "device_002",
    "device": "iPhone 15",
    "browser": "Safari 17.0",
    "ip": "192.168.1.101",
    "location": "San Francisco, CA",
    "current": false,
    "last_active": "2024-09-14T22:15:00Z"
  },
  {
    "id": "device_003",
    "device": "Windows Desktop",
    "browser": "Firefox 119.0",
    "ip": "203.0.113.45",
    "location": "New York, NY",
    "current": false,
    "last_active": "2024-09-13T16:45:00Z"
  }
]